{
  "$schema": "https://commandlayer.org/agent-cards/schemas/v1.1.0/agent.card.schema.json",
  "$id": "https://commandlayer.org/agent-cards/agents/v1.1.0/commercial/shipagent.eth.json",
  "id": "shipagent.eth",
  "slug": "shipagent",
  "display_name": "Ship Agent",
  "description": "Protocol reference card for the ship verb. Binds ENS identity, direct Commercial v1.1.0 schema URLs, and the canonical x402 payment-aware entrypoint.",
  "owner": "commandlayer.eth",
  "ens": "shipagent.eth",
  "version": "1.1.0",
  "status": "protocol_reference",
  "class": "commercial",
  "implements": [
    "ship"
  ],
  "schemas": {
    "request": "https://raw.githubusercontent.com/commandlayer/protocol-commercial/refs/tags/v1.1.0/schemas/v1.1.0/commercial/ship/ship.request.schema.json",
    "receipt": "https://raw.githubusercontent.com/commandlayer/protocol-commercial/refs/tags/v1.1.0/schemas/v1.1.0/commercial/ship/ship.receipt.schema.json"
  },
  "schemas_mirror": {
    "request": "https://commandlayer.org/schemas/v1.1.0/commercial/ship/ship.request.schema.json",
    "receipt": "https://commandlayer.org/schemas/v1.1.0/commercial/ship/ship.receipt.schema.json"
  },
  "entry": "x402://shipagent.eth/ship/v1.1.0",
  "capabilities": {
    "operations": [
      "create_shipment",
      "assign_carrier",
      "update_tracking"
    ],
    "input_types": [
      "application/json"
    ],
    "output_types": [
      "application/json"
    ]
  },
  "meta": {
    "publisher": "CommandLayer",
    "contact": "dev@commandlayer.org",
    "tags": [
      "commercial",
      "ship",
      "protocol-reference"
    ],
    "links": [
      "https://commandlayer.org/schemas/v1.1.0/commercial/ship/ship.request.schema.json",
      "https://commandlayer.org/schemas/v1.1.0/commercial/ship/ship.receipt.schema.json"
    ]
  },
  "networks": [
    "eip155:1"
  ],
  "license": "Apache-2.0",
  "created_at": "2025-11-22T00:00:00Z",
  "updated_at": "2026-03-19T00:00:00Z"
}
