{
  "$schema": "https://commandlayer.org/agent-cards/schemas/v1.1.0/agent.card.schema.json",
  "$id": "https://commandlayer.org/agent-cards/agents/v1.1.0/commercial/purchaseagent.eth.json",
  "id": "purchaseagent.eth",
  "slug": "purchaseagent",
  "display_name": "Purchase Agent",
  "description": "Protocol reference card for the purchase verb. Binds ENS identity, direct Commercial v1.1.0 schema URLs, and the canonical x402 payment-aware entrypoint.",
  "owner": "commandlayer.eth",
  "ens": "purchaseagent.eth",
  "version": "1.1.0",
  "status": "protocol_reference",
  "class": "commercial",
  "implements": [
    "purchase"
  ],
  "schemas": {
    "request": "https://raw.githubusercontent.com/commandlayer/protocol-commercial/refs/tags/v1.1.0/schemas/v1.1.0/commercial/purchase/purchase.request.schema.json",
    "receipt": "https://raw.githubusercontent.com/commandlayer/protocol-commercial/refs/tags/v1.1.0/schemas/v1.1.0/commercial/purchase/purchase.receipt.schema.json"
  },
  "schemas_mirror": {
    "request": "https://commandlayer.org/schemas/v1.1.0/commercial/purchase/purchase.request.schema.json",
    "receipt": "https://commandlayer.org/schemas/v1.1.0/commercial/purchase/purchase.receipt.schema.json"
  },
  "entry": "x402://purchaseagent.eth/purchase/v1.1.0",
  "capabilities": {
    "operations": [
      "capture_order",
      "settle_purchase",
      "record_order"
    ],
    "input_types": [
      "application/json"
    ],
    "output_types": [
      "application/json"
    ]
  },
  "meta": {
    "publisher": "CommandLayer",
    "contact": "dev@commandlayer.org",
    "tags": [
      "commercial",
      "purchase",
      "protocol-reference"
    ],
    "links": [
      "https://commandlayer.org/schemas/v1.1.0/commercial/purchase/purchase.request.schema.json",
      "https://commandlayer.org/schemas/v1.1.0/commercial/purchase/purchase.receipt.schema.json"
    ]
  },
  "networks": [
    "eip155:1"
  ],
  "license": "Apache-2.0",
  "created_at": "2025-11-22T00:00:00Z",
  "updated_at": "2026-03-19T00:00:00Z"
}
