{
  "$schema": "https://commandlayer.org/agent-cards/schemas/v1.1.0/agent.card.schema.json",
  "$id": "https://commandlayer.org/agent-cards/agents/v1.1.0/commons/formatagent.eth.json",
  "id": "formatagent.eth",
  "slug": "formatagent",
  "display_name": "Format Agent",
  "description": "Protocol reference card for the format verb. Binds ENS identity, direct Commons v1.1.0 schema URLs, and the canonical x402 entrypoint.",
  "owner": "commandlayer.eth",
  "ens": "formatagent.eth",
  "version": "1.1.0",
  "status": "protocol_reference",
  "class": "commons",
  "implements": [
    "format"
  ],
  "schemas": {
    "request": "https://raw.githubusercontent.com/commandlayer/protocol-commons/refs/tags/v1.1.0/schemas/v1.1.0/commons/format/format.request.schema.json",
    "receipt": "https://raw.githubusercontent.com/commandlayer/protocol-commons/refs/tags/v1.1.0/schemas/v1.1.0/commons/format/format.receipt.schema.json"
  },
  "schemas_mirror": {
    "request": "https://commandlayer.org/schemas/v1.1.0/commons/format/format.request.schema.json",
    "receipt": "https://commandlayer.org/schemas/v1.1.0/commons/format/format.receipt.schema.json"
  },
  "entry": "x402://formatagent.eth/format/v1.1.0",
  "capabilities": {
    "operations": [
      "normalize_layout",
      "apply_style_rules",
      "restructure_output"
    ],
    "input_types": [
      "text/plain",
      "text/markdown",
      "application/json"
    ],
    "output_types": [
      "text/markdown",
      "text/html",
      "application/json"
    ]
  },
  "meta": {
    "publisher": "CommandLayer",
    "contact": "dev@commandlayer.org",
    "tags": [
      "commons",
      "format",
      "protocol-reference"
    ],
    "links": [
      "https://commandlayer.org/schemas/v1.1.0/commons/format/format.request.schema.json",
      "https://commandlayer.org/schemas/v1.1.0/commons/format/format.receipt.schema.json"
    ]
  },
  "networks": [
    "eip155:1"
  ],
  "license": "Apache-2.0",
  "created_at": "2025-11-22T00:00:00Z",
  "updated_at": "2026-03-19T00:00:00Z"
}
